,職稱,更新日期,薪資待遇,公司名稱,工作性質,公司地址
674,Senior Engineer 資深工程師 (工作地點-桃園機場) ,11/14,待遇面議,FedEx_荷蘭商聯邦快遞國際股份有限公司台灣分公司,全職,桃園市大園區桃園機場二期貨運航站航勤北路8-1號5樓
675,AI Software Intern 人工智慧軟體實習生 (台北) ,11/05,時薪176元,立達軟體科技股份有限公司,兼職 - 長期工讀、短期工讀、假日工讀、寒假工讀、暑假工讀,台北市南港區忠孝東路六段124號4樓
676,數據分析師(學士) ,11/16,"月薪35,000~60,000元",弈樂科技股份有限公司,全職,台中市西屯區安和東路3號6樓
677,AI Software Intern 人工智慧軟體實習生 (台北) ,11/05,時薪176元,立達軟體科技股份有限公司,兼職 - 長期工讀、短期工讀、假日工讀、寒假工讀、暑假工讀,台北市南港區忠孝東路六段124號4樓
678,【D800-2302171】 Small cell SW Validation Engineer 工程師(Automation Engineer) ,11/17,待遇面議,亞旭電腦股份有限公司,全職,新北市中和區建康路119號10樓
679,AI工程師 ,11/16,"月薪35,000~45,000元",鴻享科技股份有限公司,全職,桃園市桃園區正光路423-7號2樓
680,Senior Full-stack Engineer- Taoyuan/Hybrid ,11/13,待遇面議,美商科磊股份有限公司台灣分公司_KLA Taiwan,全職,桃園市中壢區
681,『網頁前端工程師』★需提供作品★ ,11/15,"月薪45,000~60,000元",星光整合行銷有限公司,全職,台中市西屯區西屯路二段256巷6號2樓之2
682,後端工程師 Jr./Sr. Backend Engineer (Django)[E04] ,11/15,"年薪1,200,000元以上",台北派兒有限公司,全職,台北市大同區南京西路18巷10號2樓
683,MFMG－生技工程師 ,11/14,待遇面議,瑞健股份有限公司,全職,桃園市桃園區國聖二街136號
684,車載IC 驗證及軟韌體開發研發工程師(S1S1) ,11/15,待遇面議,聯詠科技股份有限公司,全職,新竹市創新一路1-2號
685,【日商】數據科學家 ,11/13,"月薪30,000~80,000元",日商邦德電子商務股份有限公司台灣分公司,全職,台北市松山區南京東路
686,軟體研發工程師 ,11/15,待遇面議,迅得機械股份有限公司,全職,桃園市中壢區榮民路421號
687,資訊工程師 ,05/31,"月薪30,000~50,000元",多采工程顧問有限公司,全職,台北市文山區景文街43號5樓
688,Java/Go 平台研發工程師 (彈性遠端) ,11/17,"年薪1,000,000~2,000,000元",可因科技有限公司,全職,台北市中山區
689,(資深)後端系統開發工程師 ,11/14,待遇面議,英屬開曼群島商萬里雲互聯股份有限公司台灣分公司,全職,台北市信義區基隆路一段333號33樓3308室
690,全端工程師 Full-stack(Hsinchu) ,04/06,待遇面議,愛瑪麗歐股份有限公司,全職,新竹縣竹北市縣政九路159號4樓
691,產品研發工程師 ,10/24,"月薪30,000~100,000元",越世資安股份有限公司,全職,新北市三重區重新路四段63號16樓
692,6231 - (Sr.) Application Engineer ,11/17,待遇面議,台灣羅德史瓦茲有限公司(ROHDE&SCHWARZ),全職,台北市內湖區堤頂大道二段89號4樓
693,Senior Software Engineer (3D Model Conversion & Rendering) ,11/15,"年薪2,500,000元以上",HOMEE AI_合宜家居股份有限公司,全職,台北市中山區樂群二路187號7樓
694,軟體測試工程師 QA Testing Engineer ,11/14,待遇面議,奧義智慧科技股份有限公司,全職,新北市板橋區遠東路3號6樓
695,【學生實習專案】2023實習生招募 –資料科學工程師(竹科-Intern) ,11/14,"月薪30,000元以上",晶元光電股份有限公司(晶電),兼職 - 長期工讀,新竹市力行路21號
696,[HARU含春]網站行銷數據分析師 -品牌部 ,11/16,"月薪35,000~45,000元",春霖國際股份有限公司,全職,台北市中山區敬業一路128巷32號2樓
697,〔台中-西區〕資料工程師 ,11/17,"月薪42,000~90,000元",敦謙國際智能科技股份有限公司,全職,台中市西區國泰金融大樓(台中市西區英才路 530 號) 24 樓
698,"Software Engineer, IT and SRE ",11/06,"年薪1,100,000~1,300,000元",臺灣發展軟體科技股份有限公司,全職,台北市內湖區瑞光路
699,間時工讀_工研院資通所_自駕車AI物件偵測與融合技術實習生(U101) ,11/13,時薪180元以上,工研院 _財團法人工業技術研究院,兼職 - 短期工讀,新竹縣竹東鎮中興路四段195號
700,物聯網/後端_系統整合工程師 ,11/03,"月薪38,000元以上",川弘科技有限公司,全職,台中市大里區中興路一段159號3樓
701,車用軟體系統工程師(遠端工作 WFH) ,11/14,待遇面議,富智捷股份有限公司,全職,新竹市科學園區創新二路一號3樓
702,Junior Data Analyst | 資料分析師 ,11/14,"月薪30,000~35,000元",麻布數據科技股份有限公司,全職,台北市信義區基隆路二段
703,(2024 New College Grad) Analog Design Engineer(High Speed) _(限即將畢業、剛畢業或工作經驗一年以下者) ,11/06,待遇面議,台灣亞德諾半導體股份有限公司,全職,新竹縣竹北市
704,自駕前端軟體工程師 ,11/13,待遇面議,勤崴國際科技股份有限公司,全職,桃園市桃園區
705,軟體研發工程師-T1000D ,11/09,待遇面議,智邦科技股份有限公司,全職,新竹市研新三路1號(新竹科學工業園區)
706,AI應用系統工程師 ,11/15,待遇面議,新代科技股份有限公司,全職,新竹市科學工業園區研發二路25號
707,QA Automation Engineer_EEcoex (工作地點：新店) ,11/17,待遇面議,印度商威普羅股份有限公司台灣分公司,全職,新北市新店區捷運大坪林站附近
708,軟體類--Data Scientist Engineer (高雄) ,10/11,待遇面議,華邦電子股份有限公司,全職,高雄市路竹區路科五路35號
709,IoT物聯網工程師 ,11/15,待遇面議,工智聯科技股份有限公司,全職,新北市土城區忠承路101號12樓(永寧站2號出口)
710,新竹｜軟體開發部｜Backend Engineer 後端工程師 ,11/09,"年薪700,000~1,200,000元",汪喵星球_自力耕生股份有限公司,全職,新竹市東區光復路二段
711,AI/ML Engineer ,11/14,待遇面議,久勁科技有限公司,全職,台北市大安區
712,軟體驗證工程師(Software Validation Engineer)_Taoyuan (Hybrid) ,11/15,待遇面議,hyve solutions_海峰電腦股份有限公司,全職,桃園市龜山區文化二路202號4樓
713,工業工程師 ,11/16,"月薪48,000~65,000元",台灣恩慈股份有限公司,全職,嘉義縣大林鎮大美里大埔美園區二路31號
714,"QA Software Engineer Intern/IoT Software Tester (fixed-term contractor until June 30, 2024) ",11/16,時薪176元以上,"West Pharmaceutical Services Asia, Ltd_西氏亞洲有限公司",兼職 - 長期工讀,台中市西屯區文心路二段107號12樓
715,系統工程師 ,11/06,"月薪40,000~60,000元",StreetVoice _街聲股份有限公司,全職,台北市松山區光復北路11巷35號11樓
716,【日本東京】IT工程師招募（赴日本工作/線上面試/在台可應徵） ,11/14,待遇面議,株式会社シエス情報,全職,日本110-0015 東京都台東区東上野1-10-1 SK-BLD 2F
717,【學生實習】大數據分析/量化分析實習生 ,10/25,時薪176~190元,台灣經濟新報文化事業股份有限公司,兼職 - 短期工讀,台北市信義區東興路57號11樓
718,SW QA Engineer (Contractor 約聘半年) (請至連結投遞中英文履歷) ,11/17,待遇面議,美商恩傑有限公司,全職,新北市板橋區縣民大道二段68號14樓
719,工研院電光系統所_人工智慧演算法開發工程師(T400) ,11/13,待遇面議,工研院 _財團法人工業技術研究院,全職,新竹縣竹東鎮中興路四段195號
720,BI 資料分析師 (BI Data Analyst) ,11/07,待遇面議,騰創數析股份有限公司,全職,台北市中山區松江路101號10樓
721,IT軟體工程師(Data Engineer) ,10/30,待遇面議,GARMIN_台灣國際航電股份有限公司,全職,新北市汐止區新台五路一段97號37樓
722,Senior EM Analysis / ESD Applications Product Engineer ,10/19,待遇面議,"Synopsys Taiwan Co., Ltd._台灣新思科技股份有限公司",全職,新竹縣竹北市
723,Product Security Engineer/ Technical PM ,11/17,待遇面議,美商安邁科技股份有限公司台灣分公司,全職,新北市汐止區新台五路一段95號36樓
724,軟體系統研發工程師 ,10/24,待遇面議,中華資安國際股份有限公司,全職,台北市大安區愛國東路 31 號通信大樓 11 樓
725,MIT-北科大 城市科學實驗室副研究員-AI工程師 ,11/12,待遇面議,國立臺北科技大學,全職,台北市大安區忠孝東路三段46號1樓
726,資訊工程師 ,11/17,"月薪37,000~53,000元",財團法人臺灣海洋保育與漁業永續基金會,全職,台北市中正區詔安街284號
727,8030：軟韌體工程師 ,11/17,待遇面議,耀登科技股份有限公司,全職,桃園市八德區和平路772巷19號(334)
728,軟體技術高級工程師 ,11/08,待遇面議,神聚系統整合有限公司,全職,新竹縣竹北市光明六路87之5號11樓之1室
729,氣象研究助理(計畫約聘/駐點氣象署)(PS120) ,11/17,"月薪38,000元以上",資拓宏宇國際股份有限公司,全職,台北市中正區公園路64號(交通部中央氣象署)
730,AI專案工程師（111年度年薪78萬至98萬起） ,11/15,"月薪48,000元以上",豐興鋼鐵股份有限公司,全職,台中市后里區甲后路一段998號
731,幼兒園陪玩老師/遊戲程式設計老師 (新店) ,11/09,"時薪500~1,000元",臺北市私立何氏語文短期補習班,兼職 - 長期工讀、短期工讀,新北市新店區
732,PD0751 資料科學家Data Scientist(內湖) ,10/19,待遇面議,仁寶電腦工業股份有限公司,全職,台北市內湖區瑞光路581號(114)
733,財務資料庫_管理師 ,11/01,"月薪30,000~35,000元",台灣經濟新報文化事業股份有限公司,全職,台北市信義區東興路57號11樓
734,【資訊中心】數據助理 ,11/16,時薪200元以上,公隆實業股份有限公司,兼職 - 長期工讀,台北市信義區基隆路一段155號9樓
735,大數據專案管理師(大園廠) ,11/16,待遇面議,成運汽車製造股份有限公司,全職,桃園市大園區民生路106號
736,資料工程師(資深專員) ,11/13,待遇面議,大陸工程股份有限公司,全職,台北市大安區敦化南路二段95號
737,軟體工程師1701 ,11/03,待遇面議,Phison Electronics Corp_群聯電子股份有限公司,全職,苗栗縣竹南鎮群義路1號
738,Android手機軟體測試工程師 ,11/14,"月薪35,000元以上",雲景科技股份有限公司,全職,新北市板橋區(依業務需求分派)
739,數據資料分析及報表自動化人員（台中） ,10/30,待遇面議,香港商滙智環球顧問有限公司台灣分公司,全職,台中市南屯區
740,韌體設計資深工程師 ,05/04,"月薪40,000~80,000元",香港商捷聯電子有限公司台灣分公司,全職,台北市中正區100 台北市中正區館前路2號12樓1232室
741,軟體工程師 ,11/13,待遇面議,剛鈺股份有限公司,全職,新北市林口區文化二路一段266號21樓之4
742,Software Design Engineer-TC230160 ,11/16,待遇面議,"Super Micro Computer, Inc._美超微電腦股份有限公司",全職,新北市中和區建一路150號3樓
743,AI/CV Team Lead /Sr. Computer Vision Engineer 電腦視覺工程師 ,11/17,"年薪1,800,000~2,500,000元",數位身分股份有限公司,全職,台北市大同區承德路一段17號10樓之8
744,Red Hat OpenShift / K8S 【技術顧問/工程師】 (新竹) ,11/14,"月薪55,000~95,000元",聚達系統股份有限公司,全職,新竹市經國路二段295號13樓之3
745,[Server]光學開發工程師(桃園) ,11/16,"月薪35,000元以上",Inventec_英業達股份有限公司,全職,桃園市桃園區大智路88號
746,AI雲端系統工程師 ,11/15,"月薪50,000元以上",網威智慧科技股份有限公司,全職,台北市內湖區港墘路200號7樓
747,軟體工程師 ,11/07,待遇面議,奧創系統科技有限公司,全職,新北市三重區重新路五段609巷4號4樓之1
748,User Experience Software Engineer 使用者經驗軟體工程師-J01962 ,11/08,待遇面議,奧啓迪科技股份有限公司,全職,新北市新店區北新路3段207之5號13樓
749,軟體工程師 ,11/06,待遇面議,芯測科技股份有限公司,全職,新竹縣竹北市台元一街6號7樓之5
750,數據科學家Data Scientist (Data Science & AI Team) ,11/13,待遇面議,鴻海精密工業股份有限公司,全職,新北市土城區
751,ICC_Data Engineer ,11/13,待遇面議,Zyxel Networks_兆勤科技股份有限公司(合勤集團),全職,新竹市新竹科學園區工業東九路2號/新北市新店區北新路3段225號11樓
752,【2024 RDSS研發替代役】系統設計工程師 ,11/16,待遇面議,聯發科技集團_達發科技股份有限公司,全職,新竹縣竹北市台元二街1號5樓之1
753,Junior Machine Learning Engineer ,11/06,"月薪60,000~90,000元",凸版蓋特資訊股份有限公司,全職,台北市中正區寧波東街1號6樓
754,Full Stack Engineer Intern (React & Node.js) ,11/16,時薪300~400元,賦語科技股份有限公司,兼職,新北市三重區重新路一段108號3樓
755,Software Engineer 軟體工程師-TC230019 ,11/16,待遇面議,"Super Micro Computer, Inc._美超微電腦股份有限公司",全職,桃園市八德區興豐路1899號
756,AIoT 工程師 ,11/16,待遇面議,詮鼎科技股份有限公司,全職,台北市南港區經貿二路189號10樓
757,AI數據策略研究員(投資顧問部) ,11/13,待遇面議,永豐金證券股份有限公司,全職,台北市中正區
758,Supply Chain Analyst/Procurement Analyst ,11/17,"月薪35,000~40,000元",宸品有限公司,全職,台北市南港區八德路四段778號4樓
759,數據工程師實習生 Data Science Intern ,11/08,時薪180~220元,COMMEET_擁樂數據服務股份有限公司,兼職 - 長期工讀,台北市松山區長安東路二段225號A棟1樓之1
760,QA 資深軟體測試工程師 - 台北 ,11/14,"月薪65,000~100,000元",盈通管理顧問有限公司,全職,台北市大安區忠孝東路
761,後端軟體工程師(汐止) ,11/16,待遇面議,欣技資訊股份有限公司,全職,新北市汐止區大同路三段196-3號5樓(世界經貿大樓C棟)
762,數位科技處-數據管理師(PM) ,11/15,待遇面議,永豐商業銀行股份有限公司,全職,台北市中山區八德路二段308號
763,數位科技處-數據分析師 ,11/15,待遇面議,永豐商業銀行股份有限公司,全職,台北市中山區八德路二段308號
764,測試工程師 QA Engineer ,11/17,待遇面議,偉康科技股份有限公司,全職,台北市松山區南京東路五段161號4樓
765,軟體開發工程師_12698 ,11/14,"月薪32,000~62,000元",和碩集團_和碩聯合科技股份有限公司,全職,台北市北投區立功街76號
766,研發類 - 軟硬體整合工程師(MT000) ,11/15,待遇面議,旺宏電子股份有限公司,全職,新竹市力行路16號
767,【GAI菁英專區】工研院資通所_電腦視覺與生成式AI工程師(T2) ,11/13,待遇面議,工研院 _財團法人工業技術研究院,全職,新竹縣竹東鎮中興路四段195號
768,系統軟體開發工程師-高雄 ,11/16,待遇面議,易捷系統股份有限公司,全職,高雄市楠梓區
769,Junior Options Trader 初級選擇權交易員 ,11/16,待遇面議,TETRION CAPITAL LIMITED_香港商天銳資本有限公司,全職,台北市內湖區內湖成功路五段396號1樓
770,[2024 研發替代役] NPI Test Engineer (RDSS Intern) ,11/09,待遇面議,NVIDIA_新加坡商輝達開發有限公司台灣分公司,全職,新竹市
771,【實習/工讀】自營部-期貨自營處工讀生 ,11/17,時薪183元以上,群益金鼎證券股份有限公司,兼職,台北市松山區民生東路三段156號13F
772,工研院資通所_深度學習工程師(K1) ,11/13,待遇面議,工研院 _財團法人工業技術研究院,全職,新竹縣竹東鎮中興路四段195號
773,(CEG) BMC Firmware Engineer ,11/17,待遇面議,美商安邁科技股份有限公司台灣分公司,全職,新北市汐止區新台五路一段95號36樓
774,總公司 後端工程師 Backend Engineer_台北 ,11/15,待遇面議,家樂福_家福股份有限公司,全職,台北市北投區大業路136號
775,【Innovation Development】軟體工程師 Software Engineer ,11/09,待遇面議,甲尚股份有限公司,全職,新北市新店區寶橋路235巷126號2樓
776,自動化軟體工程師_12573 ,11/15,"月薪32,000~62,000元",和碩集團_和碩聯合科技股份有限公司,全職,台北市北投區立功街76號
777,IT Developer ( IT 程式設計師) ,11/13,待遇面議,新加坡商威兆科技有限公司台灣分公司,全職,台北市內湖區瑞湖街
778,Devops Engineer ,11/16,待遇面議,優必達台灣有限公司,全職,台北市松山區復興北路99號10樓
779,Information Security Engineer 資訊安全工程師 ,11/16,"年薪800,000~1,800,000元",OpenNet_開網有限公司,全職,台北市中正區杭州南路一段15-1號16F
780,新竹_機器學習工程師 ,10/24,待遇面議,慧通智聯股份有限公司,全職,新竹市
781,PE - Foundry Lead(Packaging/ High Speed) ,11/14,待遇面議,Siemens EDA_愛爾蘭商西門子電子設計自動化股份有限公司台灣分公司,全職,新竹市
782,CIM工程師 ,11/16,待遇面議,隆達電子股份有限公司,全職,苗栗縣竹南鎮廣源科技園區科義街1號
783,Mid. - Sr. 後端工程師_Backend Engineer ,10/26,"年薪1,000,000~1,800,000元",英屬開曼群島商慧康生活科技股份有限公司台灣分公司,全職,台北市內湖區瑞光路478巷18弄32號4樓
784,影像演算法工程師 ,10/26,待遇面議,立達信集團_立信電子科技有限公司,全職,台北市中山區民權東路三段4號15樓
785,軟體工程師 (深度學習專案)-高雄 ,11/16,待遇面議,輝創電子股份有限公司,全職,高雄市苓雅區新光路38號22樓之1-3
786,AI人工智慧工程師&後端工程師 ,11/12,"月薪35,000~80,000元",一踢科技系統整合有限公司,全職,台北市中山區中山北路二段103號7樓-3
787,Associate Application Engineer(Calibre) ,11/15,待遇面議,Siemens EDA_愛爾蘭商西門子電子設計自動化股份有限公司台灣分公司,全職,新竹市公道五路2段120號11樓
788,Site Reliability Engineer/ 網站可靠性工程師/ DevOps/ SRE ,11/15,"月薪70,000~90,000元",紅樓創新技術股份有限公司,全職,台北市中山區民生東路三段128號14樓
789,資料工程師 Data Engineer ,11/17,待遇面議,果實夥伴股份有限公司,全職,台北市內湖區瑞光路610號2樓
790,[2024研發替代役] GPU Security Firmware Engineer (RDSS Intern) ,11/13,待遇面議,NVIDIA_新加坡商輝達開發有限公司台灣分公司,全職,台北市內湖區基湖路8號
791,機器人系統整合工程師 ,11/16,待遇面議,易捷系統股份有限公司,全職,新竹縣竹北市溪州路170巷3號
792,Robotics Software Engineer (Taiwan) ,11/16,"月薪45,000~120,000元",全智通機器人股份有限公司,全職,台北市內湖區瑞光路168號4樓
793,2731 - (Sr.) Application Engineer ,11/17,待遇面議,台灣羅德史瓦茲有限公司(ROHDE&SCHWARZ),全職,台北市內湖區堤頂大道二段89號4樓
794,【研發替代役】QA engineer自動化軟體測試工程師 ,11/17,待遇面議,全曜財經資訊股份有限公司,全職,新北市板橋區文化路一段266號15樓
795,(竹北)資深實體設計工程師 (APR/Physical Design Engineer) ,11/01,待遇面議,DIGWISE_崛智科技股份有限公司,全職,新竹縣竹北市
796,System Engineer of Smart Production Line _DSM AOT (Taichung) ,11/14,待遇面議,台達電子工業股份有限公司 _DELTA ELECTRONICS INC.,全職,台中市西屯區科園一路8號
797,高雄軟體園區- 演算法工程師 (可視訊面試) ,11/13,待遇面議,鴻佰科技股份有限公司,全職,高雄市前鎮區成功二路25號
798,"Software Development Engineer in Test, Client ",11/13,"年薪1,600,000元以上","Kloudless, A Netskope Company_科迪股份有限公司",全職,台北市信義區信義路四段460號14樓
799,【智慧製造發展中心】大數據平台開發工程師/顧問 (高雄) ,11/13,待遇面議,台灣恩悌悌數據股份有限公司,全職,高雄市鼓山區明誠三路685號
800,【資訊系統類】資訊安全管理資深/高級專員 ,11/14,待遇面議,全一電子股份有限公司,全職,台南市南區新樂路24-3號
801,演算法開發工程師 ,11/02,待遇面議,晶翔機電股份有限公司,全職,新竹市東區新竹科學園區力行一路1號3樓B2
802,電力技術工程師【F】 ,11/17,待遇面議,森崴能源股份有限公司,全職,新北市土城區中央路四段49號
803,SDN網路系統工程師 ,10/23,"月薪40,000~65,000元",中華資安國際股份有限公司,全職,台北市中正區杭州南路一段26號8樓
804,AI 工程師 ,11/15,待遇面議,DIGITIMES INC._大椽股份有限公司,全職,台北市松山區民生東路四段133號12樓
805,61300-軟體研發工程師(高雄) ,11/14,待遇面議,QNAP_威聯通科技股份有限公司,全職,高雄市三民區博愛一路55號
806,後端工程師 ,11/14,"月薪35,000~50,000元",艾新科環保材料有限公司,全職,台北市信義區基隆路一段163號17樓之3
807,"Staff Software Development Engineer in Test, Data ",11/13,"年薪1,800,000元以上","Kloudless, A Netskope Company_科迪股份有限公司",全職,台北市信義區信義路四段460號14樓
808,程式軟體工程師 ,11/15,"月薪50,000~70,000元",永大杉綠能科技股份有限公司,全職,高雄市苓雅區自強路三路
809,韌體研發工程師 ,11/16,"月薪40,000~75,000元",博世科智能股份有限公司,全職,台北市大同區重慶北路二段188號10樓
810,資料分析師 ,09/23,"月薪35,000~70,000元",智庫驅動股份有限公司,全職,台北市信義區信義路4段375號9樓之2
811,軟體研發工程師-Software Engineer ,11/15,待遇面議,倚強科技股份有限公司,全職,台北市內湖區瑞光路607號9樓
812,總公司【資訊系統開發部】商業數據分析師(Business Analytics) ,10/03,待遇面議,元大人壽保險股份有限公司(總公司),全職,台北市松山區民生東路三段
813,Data Scientists (DSP and LLM) ,10/13,待遇面議,圖策科技股份有限公司,全職,台北市松山區光復南路65號13樓
814,Software Design Engineer_TC230076 ,11/16,待遇面議,"Super Micro Computer, Inc._美超微電腦股份有限公司",全職,新竹市東區公道五路二段158號11號樓之3
815,【GAI菁英專區】工研院資通所_生成式AI(文字)工程師(T3) ,11/13,待遇面議,工研院 _財團法人工業技術研究院,全職,新竹縣竹東鎮中興路四段195號
816,無線(ble/wifi)通訊軟韌體工程師 ,11/17,待遇面議,翔安生醫科技股份有限公司,全職,台南市新市區南科三路23號4樓之1C室
817,軟體設計工程師(高雄) ,11/13,"月薪40,000~70,000元",立埕工程顧問股份有限公司,全職,高雄市左營區
818,【GAI菁英專區】工研院資通所_生成式AI(文字)工程師(T3) ,11/13,待遇面議,工研院 _財團法人工業技術研究院,全職,新竹縣竹東鎮中興路四段195號
819,[2024暑期實習計畫－優先獲得畢業預聘機會] 產品測試工程師實習 Product/Test Engineer Summer Internship Program ,11/14,"月薪40,000元以上",德州儀器工業股份有限公司,全職,新北市中和區興南路一段142號
820,IIoT 軟體研發工程師 (2300DC) ,11/06,待遇面議,四零四科技股份有限公司,全職,新北市新莊區新北大道四段3號13樓
821,Software Engineer - J2073 ,11/15,待遇面議,廣達電腦股份有限公司,全職,桃園市龜山區文化二路211號
822,數位金融處-資料工程專業人員 ,11/15,待遇面議,永豐商業銀行股份有限公司,全職,台北市中山區八德路二段308號
823,【AI團隊】演算法工程師 Algorithm Engineer_台北 ,11/02,待遇面議,昕力資訊股份有限公司,全職,台北市內湖區瑞光路441.443號
824,"【DNA, Data & AI】Data Scientist & AI Engineer_資料科學家 & AI工程師 ",11/14,待遇面議,雲馥數位股份有限公司,全職,新北市三重區重新路四段12號 (近捷運菜寮站及三重站）
825,資深後端工程師 (Sr.) Backend Engineer ,11/16,待遇面議,微拓科技股份有限公司,全職,台北市松山區民生東路三段 109 號 17 樓
826,Back-End Developer(系統開發一部) ,11/13,待遇面議,永豐金證券股份有限公司,全職,新北市板橋區縣民大道二段(板橋火車站對面)
827,【ND】後端工程師 / Backend Engineer / Research Engineer ,11/16,待遇面議,杜浦數位安全股份有限公司,全職,台北市松山區光復北路11巷46號15樓
828,ICC_Web Backend Engineer(CS) ,11/16,待遇面議,Zyxel Networks_兆勤科技股份有限公司(合勤集團),全職,新北市新店區新北市新店區北新路三段223號11樓
829,影像AI演算法工程師 ,11/09,"月薪38,000~70,000元",華洋精機股份有限公司,全職,台南市永康區
830,資訊系統分析工程師 ,11/17,待遇面議,日商_建興儲存科技股份有限公司,全職,新竹市新竹市新竹科學工業園區篤行路8號
831,5G 系統軟體工程師 ,11/16,待遇面議,聯發科技股份有限公司,全職,新竹市篤行一路1號
832,量化研究員(資料科學家)(證券自營部) ,11/16,"月薪40,000元以上",國泰綜合證券股份有限公司,全職,台北市大安區敦化南路二段335號19樓
833,資訊工程師(南科) ,11/14,待遇面議,晶元光電股份有限公司(晶電),全職,台南市新市區
834,數據資料分析工程師 ,11/13,待遇面議,緯創集團_緯育股份有限公司,全職,新北市汐止區新台五路一段100號25樓
