,職稱,更新日期,薪資待遇,公司名稱,工作性質,公司地址
2158,運維工程師(英國長期外派) ,11/16,待遇面議,天旭國際科技有限公司,全職,英國
2159,"軟體工程師,演算法工程師 ",11/14,待遇面議,伊勒伯科技股份有限公司,全職,新北市中和區連城路238號5樓之1
2160,軟體開發工程師 ,11/12,待遇面議,耀騰印刷事業股份有限公司,全職,新北市中和區連城路174巷45號
2161,機器人SLAM演算法工程師 ,11/15,"月薪50,000~80,000元",泰科動力股份有限公司,全職,新北市林口區仁愛路二段502號A6 12樓
2162,資料科學家 ,11/16,待遇面議,烏龜移動科技股份有限公司,全職,台北市松山區民權東路三段144號13樓1521室
2163,軟體研發主管/主任工程師 ,11/17,待遇面議,興城科技股份有限公司,全職,桃園市中壢區吉林路27-1號7樓
2164,IoT後端工程師-智慧物聯部(IAD70) ,10/12,待遇面議,資拓宏宇國際股份有限公司,全職,新北市板橋區或是高雄前鎮區
2165,GOSC-Sr. MES Project Engineer ,11/10,待遇面議,美商英特格有限公司台灣分公司,全職,高雄市路竹區
2166,資訊室副工程師 ,11/13,"月薪32,000~38,000元",倢鋒科技股份有限公司,全職,桃園市八德區高城七街28號
2167,RF測試軟體開發工程師 (新竹/新店) ,10/20,待遇面議,海華科技股份有限公司,全職,新竹市東區公道五路二段120號8樓
2168,滲透測試/紅隊工程師 ,11/16,待遇面議,奇資訊保安及網絡有限公司,全職,台北市大安區忠孝東路四段148號9樓之4
2169,Senior Site Reliability Engineer 資深網站可靠性工程師 ,11/07,"年薪1,200,000~1,800,000元",群馥科技股份有限公司,全職,台北市中正區武昌街一段 77 號 5 樓
2170,PHP Laravel工程師(中階以上) ,11/16,"月薪70,000元以上",科爾迪股份有限公司,全職,台北市松山區復興北路143號4樓
2171,Unreal programmers (Unreal工程師) ,11/15,"月薪40,000~75,000元",必應創造股份有限公司,全職,台北市內湖區新湖一路370號4樓
2172,軟體工程師 ,11/17,待遇面議,瑞陽貿易股份有限公司,全職,新北市五股區五權七路10號
2173,RD21153 軟體工程師(電競配件) ,09/07,待遇面議,華碩電腦股份有限公司,全職,台北市北投區
2174,【SPHERE】 後端工程師 (Backend Engineer) ,11/15,"年薪600,000元以上",連宇股份有限公司,全職,台北市信義區
2175,PG-資深後端工程師(台北) ,11/13,待遇面議,杰悉科技股份有限公司,全職,台北市中山區松江路309號9樓
2176,Wi-Fi設備應用及測試工程師 ；FAE；Sales engineer ,11/17,"月薪36,000~50,000元",邁訊科技有限公司,全職,新北市新莊區新北大道三段7號14F-7
2177,驗證系統工程師 ,11/17,待遇面議,牧陽能控股份有限公司,全職,台南市歸仁區高發二路360號B棟119室(沙崙綠能科技示範場域)
2178,全端工程師 Full-Stack Engineer(車用專案) ,11/01,待遇面議,Phison Electronics Corp_群聯電子股份有限公司,全職,苗栗縣竹南鎮群義路1號
2179,AOI AI軟體開發工程師 ,11/10,待遇面議,佳研智聯股份有限公司,全職,台中市南屯區精科路2號
2180,【全球智慧製造】Data Infrastructure Engineer_新店 ,10/19,待遇面議,GARMIN_台灣國際航電股份有限公司,全職,新北市新店區
2181,PHP網頁全端工程師 ,11/17,"月薪45,000~65,000元",數位玩家資訊科技有限公司,全職,高雄市楠梓區高雄大學路700號(高雄大學創業育成中心)
2182,技術工程類 - CIM自動化工程師 - 機器視覺【高雄】 ,11/13,"月薪35,000~60,000元",日月光半導體製造股份有限公司,全職,高雄市楠梓區經三路26號
2183,測試工程師 QA Engineer (臺北 or 臺中）-知名上市行動銀行APP ,11/13,"月薪55,000~75,000元",台灣利優資訊科技有限公司,全職,台北市信義區
2184,研發單位-FPGA實習生(TG100Y) ,11/09,"月薪30,000~35,000元",智邦科技股份有限公司,全職,新竹市研新三路1號(新竹科學工業園區)
2185,【機器學習實習生】Machine Learning Intern ,10/12,時薪200元,POSITIVE GRID_佳格數位科技有限公司,兼職 - 長期工讀,台北市中山區長春路 176 號 11 樓
2186,R&D Test Development Engineer ,11/10,"年薪1,200,000~1,500,000元",Lumentum_台灣流明光學股份有限公司,全職,新北市板橋區新站路16號及16之1號32樓
2187,ESD設計工程師 ,11/07,待遇面議,英屬開曼群島商晶旭科技股份有限公司台灣分公司,全職,新竹縣竹北市高鐵一路36號9樓
2188,前端工程師 ,11/17,待遇面議,智域國際股份有限公司,全職,台北市信義區忠孝東路五段508號8樓
2189,910-軟體工程師/資深工程師(新竹縣) ,11/17,"月薪34,000~75,000元",兆赫電子股份有限公司,全職,新竹縣湖口鄉文化路2號(303)
2190,RD21216 .Net後端系統開發工程師 ,11/17,"月薪30,000~60,000元",華碩電腦股份有限公司,全職,台北市北投區
2191,Product Developer (軟體基礎建設開發) ,11/15,待遇面議,Synology_群暉科技股份有限公司,全職,新北市板橋區遠東路1號9樓
2192,(108-1)【軟體研發中心】- 系統整合開發工程師 ,11/16,待遇面議,鴻海精密工業股份有限公司,全職,新北市新店區寶高路28號
2193,商業數據分析師 ,12/28,待遇面議,台北富邦商業銀行股份有限公司,全職,台北市大安區
2194,Backend開發人員 ,11/02,待遇面議,口袋證券股份有限公司,全職,新北市板橋區三民路一段216號9樓
2195,區塊鏈工程師 ,11/15,"月薪40,000元以上",如牧創新有限公司,全職,台北市大安區敦化南路一段236巷38號3樓
2196,科技金融_人工智慧系統分析師 ,11/16,待遇面議,中國信託商業銀行股份有限公司,全職,台北市南港區經貿二路168號
2197,設計驗證工程師 ,11/16,待遇面議,晶豪科技股份有限公司,全職,新竹市工業東四路23號
2198,"軟體工程師 (C++, Linux) ",11/08,"月薪55,000~80,000元",天鏡科技股份有限公司,全職,新北市新莊區復興路1段3號之2(5F)
2199,客服工程師（高雄） ,11/10,"月薪33,000~42,000元",雲端行動科技股份有限公司,全職,高雄市鹽埕區大勇路11號4樓
2200,軟體助理工程師 ,11/17,"月薪32,000~35,000元",奇蹟行動科技有限公司,全職,台北市中山區一江街13號7樓
2201,前端軟體工程師 (Frontend開發) ,11/17,待遇面議,奇蹟行動科技有限公司,全職,台北市中山區一江街13號7樓
2202,Backend Engineer (.Net) ,11/15,待遇面議,軒昂有限公司,全職,台北市內湖區瑞光路399號11樓
2203,IoT Engineer ,11/17,"年薪680,000~1,100,000元",威摩科技股份有限公司,全職,台北市北投區懷德街93號
2204,FAE工程師/技術經理 ,10/27,待遇面議,博磊智能有限公司,全職,新竹縣竹北市復興三路二段168號19樓之1
2205,區塊鏈資安工程師 ,11/15,待遇面議,易元數位科技有限公司,全職,新竹市東區關東路158號2樓之1
2206,資訊工程師(墨西哥) ,11/17,待遇面議,麗窗企業股份有限公司,全職,墨西哥(依照公司規定分派)
2207,數據分析工程師 ,11/12,待遇面議,安瑟樂威股份有限公司,全職,台北市信義區松德路171號10樓之一
2208,研發替代役(可申請預聘)-工研院機械所-自駕車軟體研發工程師(D300) ,11/13,待遇面議,工研院 _財團法人工業技術研究院,全職,新竹縣竹東鎮中興路四段195號
2209,MA-智慧製造自動化工程師 ,11/09,"月薪34,000~60,000元",緯穎科技服務股份有限公司,全職,台南市安定區北園三路8號
2210,【台北】System administrator 系統工程師 ,11/14,待遇面議,晶密股份有限公司,全職,台北市信義區松勤街86號
2211,前瞻數位IC設計流程工程師0200 ,11/01,待遇面議,Phison Electronics Corp_群聯電子股份有限公司,全職,苗栗縣竹南鎮群義路1號
2212,軟體工程師 ,11/17,"月薪40,000~59,999元",田屋科技股份有限公司,全職,台中市太平區永平路三段143號
2213,AI影像視訊處理研發工程師(I1) ,11/15,待遇面議,聯詠科技股份有限公司,全職,新竹市創新一路1-2號
2214,《數據分析工程師》 ,11/15,待遇面議,新光合成纖維股份有限公司,全職,桃園市平鎮區延平路三段223號
2215,【審計服務】數位鑑識會計_資料分析顧問_副組長/組長/副理 ,11/14,"月薪48,000元以上",安永聯合會計師事務所,全職,台北市信義區基隆路一段333號9樓(110)
2216,軟體工程師 ,11/17,"月薪40,000~59,999元",田屋科技股份有限公司,全職,台中市太平區永平路三段143號
2217,資料科學家 (Data Scientist)-台北(Taipei) ,11/17,待遇面議,華翰物產實業股份有限公司,全職,台北市中山區樂群三路126號14樓
2218,AI數據科學家 ,11/17,"月薪40,000元以上",翔安生醫科技股份有限公司,全職,台南市新市區南科三路23號4樓之1C室
2219,系統工程師 ,11/15,待遇面議,漢堡王_家城股份有限公司,全職,台北市松山區八德路四段760號10樓之2
2220,【數位驅動】行銷數據應用分析師(數數發中心， DDT) ,11/17,待遇面議,國泰世華商業銀行股份有限公司_人力資源部,全職,台北市信義區
2221,DBA資料庫管理師 ,11/13,"月薪40,000~70,000元",台灣宸運雲端有限公司,全職,台中市西屯區安和路168號6樓之一
2222,測試工程師/資深測試工程師 Software Development Engineer in Test(SDET) ,11/09,待遇面議,TVBS_聯利媒體股份有限公司,全職,台北市內湖區瑞光路451號
2223,數據工程師(學士) ,11/16,"月薪35,000~60,000元",弈樂科技股份有限公司,全職,台中市西屯區安和東路3號6樓
2224,數位前端整合工程師/Digital Frontend Integration Engineer ,11/17,待遇面議,創未來科技股份有限公司,全職,新竹市東區公道五路三段1號7樓之8
2225,韌體研發工程師 ,11/10,"月薪55,000元以上",億晟泓科技股份有限公司,全職,新北市新店區中興路2段192號10樓之2
2226,系統設計工程師 ,11/14,"月薪35,000元以上",和瑩電腦股份有限公司,全職,台北市大安區樂利路60號2樓
2227,JR101534 科技創新與治理研究人員(數據應用) ,11/16,待遇面議,中國人壽保險股份有限公司(總公司),全職,台北市松山區敦化北路135號
2228,全端工程師(宜科) ,11/13,待遇面議,瑞訊智能股份有限公司,全職,宜蘭縣宜蘭市宜科東路5號4樓之11
2229,(Senior) Android Automation Test Engineer 自動化測試工程師 - 板橋 - TS05G ,11/14,待遇面議,Tata Consultancy Services Limited Taiwan Branch_印度商塔塔顧問服務有限公司台灣分公司,全職,新北市板橋區
2230,《數位科技》PHP後端工程師 Back End Engineer(3D遊戲設計/VR沉浸網頁) ,11/16,待遇面議,王一設計_王一國際展覽室內裝修設計有限公司,全職,台北市松山區復興北路167號12樓之2
2231,資料工程師 ,11/09,"月薪45,000~75,000元",美商宇心生醫股份有限公司台灣分公司,全職,台北市中正區新生南路一段148號9樓
2232,工程一組 嵌入式系統開發工程師 ,11/15,待遇面議,集佳股份有限公司,全職,新北市汐止區康寧街169巷31號9-2樓
2233,Business Analytics Manager ,11/17,待遇面議,Klook客路_客遊天下旅行社有限公司,全職,台北市松山區
2234,CTO 技術長 ,11/09,待遇面議,赫雅商務股份有限公司,高階,台中市西屯區潮洋里市政北二路282號20樓之5
2235,資深全端工程師 ,11/17,待遇面議,財團法人台灣地理資訊中心,全職,台北市中正區羅斯福路一段七號六樓
2236,資深全端工程師 ,11/17,待遇面議,財團法人台灣地理資訊中心,全職,台北市中正區羅斯福路一段七號六樓
2237,【技術研發】Micro LED 封裝製程與開發工程師-新竹廠-R07 ,11/13,待遇面議,友達光電股份有限公司,全職,新竹市工業東三路1號
2238,Business Analytics Manager ,11/17,待遇面議,Klook客路_客遊天下旅行社有限公司,全職,台北市松山區
2239,C.顧問類-系統架構師 ,11/17,待遇面議,資誠創新諮詢有限公司,全職,台北市信義區基隆路一段333號27樓
2240,半導體自動化＿專用設備研發主管(機電整合高階人才)_新竹分公司 ,11/16,"年薪2,500,000~3,500,000元",萬潤科技股份有限公司,高階,新竹市工業東四路4號2樓
2241,Azure SRE Engineer ,11/16,待遇面議,拓連科技股份有限公司,全職,台北市南港區三重路19-13號15樓
2242,智慧製造－AI科學家/數據科學家/數據分析師（海外地區） ,11/15,待遇面議,臻鼎科技股份有限公司,全職,桃園市大園區
2243,React 前端設計師 ,11/08,"月薪30,000~40,000元",耀瑄科技股份有限公司,全職,高雄市前鎮區
2244,機器人應用軟體開發工程師 ,11/15,"月薪35,000~80,000元",美商螳螂機器人科技股份有限公司台灣分公司,全職,台北市士林區中正路
2245,【電子商務部】Python 爬蟲工程師 ,11/15,"月薪35,000~45,000元",積大企業有限公司,全職,新北市汐止區新台五路一段79號11樓
2246,法遵部門洗錢防制分析規劃人員 ,11/16,"月薪33,000~48,000元",臺灣中小企業銀行股份有限公司,全職,台北市大同區
2247,【2024研發替代役暨預聘】軟體設計資深工程師_電動車軟體新技術開發(中壢) ,11/16,"月薪59,000~75,000元",台達電子工業股份有限公司 _DELTA ELECTRONICS INC.,全職,桃園市中壢區東園路16號
2248,AOI工程師 ,11/16,待遇面議,豐達科技股份有限公司,全職,桃園市平鎮區太平東路1號
2249,Golang工程師(高雄) ,11/14,待遇面議,緲思網絡科技有限公司,全職,高雄市前鎮區復興四路1號10樓
2250,Machine Learning Engineer 機器學習工程師(研發替代役可) ,11/15,待遇面議,玩美移動股份有限公司,全職,新北市新店區民權路98號14樓
2251,Motor Design Engineer 馬達設計工程師 ,11/15,待遇面議,Gogoro Taiwan Limited_睿能創意股份有限公司,全職,桃園市龜山區頂湖路33號
2252,研發五部-電芯工程師 ,11/15,待遇面議,順達科技股份有限公司,全職,桃園市龜山區文禾路188號13樓
2253,"Senior Engineer, Software Development (資深軟韌體開發工程師) ",11/13,待遇面議,美商盛伯林科技國際有限公司台灣分公司,全職,台北市信義區基隆路二段109號11樓A室
2254,網頁後端工程師 ,10/19,"月薪26,400~50,000元",魔法堂科技股份有限公司,全職,新北市中和區連城路192號4樓之1
2255,系統開發工程師(資訊處) ,11/13,待遇面議,永豐金證券股份有限公司,全職,新北市板橋區縣民大道二段(板橋火車站對面)
2256,網頁後端工程師 ,10/19,"月薪26,400~50,000元",魔法堂科技股份有限公司,全職,新北市中和區連城路192號4樓之1
2257,SG_AI Engineer ,11/17,待遇面議,博弘雲端科技股份有限公司,全職,新加坡Singapore (Stationed or on a business trip)
2258,網頁後端開發工程師 ,11/08,待遇面議,汎定科技股份有限公司,全職,台北市內湖區瑞光路335號7樓
2259,高級軟體測試工程師 (Quality Assurance Engineer ) ,11/03,"月薪30,000~55,000元",台灣賀思達科技有限公司,全職,台北市松山區
2260,研發替代役-資安軟體應用研發工程師 ,11/02,待遇面議,誠雲科技股份有限公司,全職,台中市西屯區台灣大道四段925號16F-3
2261,軟體測試開發工程師(Junior/Senior/Lead) ,11/15,"年薪560,000~1,800,000元",全支付電子支付股份有限公司,全職,台北市中山區敬業四路33號9樓
2262,光學影像工程師 ,10/30,"月薪35,000~55,000元",慧演智能股份有限公司,全職,台中市大里區中興路一段159之一號3樓
2263,後端工程師 ,11/15,"月薪50,000元以上",天昕科技股份有限公司,全職,台北市大安區辛亥路一段50號4樓
2264,Internship (Full time/Part time) / 實習計畫 ,11/15,待遇面議,生德奈生物科技股份有限公司,兼職 - 長期工讀,台北市信義區
2265,Senior Software/ Firmware Engineer ,11/09,"月薪45,000元以上",新堡科技股份有限公司,全職,台北市內湖區行愛路128號2樓
2266,Senior Backend Engineer ,11/16,待遇面議,雲象科技股份有限公司,全職,台北市南港區忠孝東路7段508號15樓
2267,Supply Chain Transformation Specialist 供應鏈數位轉型專員 (新竹竹北) ,11/16,待遇面議,液空台灣_亞東工業氣體股份有限公司,全職,新竹縣竹北市復興三路2段168號12樓
2268,【研發部 R&D】SRE工程師 ,11/16,待遇面議,戴數科技有限公司,全職,台中市西區忠明南路62號3樓-2
2269,【全遠端｜年薪 100-170 萬】資深後端工程師｜Senior Backend Engineer｜視訊面試 線上面試｜長期招募中 ,11/17,"年薪1,000,000~1,700,000元",即準數位科技股份有限公司,全職,台北市松山區
2270,機器⼈導航演算法⼯程師 ,11/15,"月薪50,000~80,000元",泰科動力股份有限公司,全職,新北市林口區仁愛路二段502號A6 12樓
2271,Python程式線上直播課程講師 ,11/15,"時薪400~1,000元",聯成電腦有限公司(聯成電腦/聯成外語),兼職,台北市大安區忠孝東路四段178號4樓
2272,非揮發性記憶體特性分析工程師1000 ,11/01,待遇面議,Phison Electronics Corp_群聯電子股份有限公司,全職,苗栗縣竹南鎮群義路1號
2273,網路/系統工程師(S10) ,11/16,待遇面議,凌群電腦股份有限公司,全職,台北市萬華區成都路102號2樓之一
2274,電子軔體工程師 ,11/14,"月薪35,000~55,000元",久正光電股份有限公司,全職,台中市西屯區工業六路8號
2275,大數據工程師、軟體設計工程師 ,10/21,待遇面議,集先鋒科技有限公司,全職,新北市板橋區文化路二段500號4樓
2276,"實習- 資料科學研發研究員 (數數發中心, DDT)_GOLF平台 ",11/09,時薪200元,國泰金控_國泰金融控股股份有限公司,兼職,台北市信義區松仁路7號
2277,先進機器人研發工程師 ,11/17,待遇面議,大立光電股份有限公司,全職,台中市南屯區精科路11號
2278,Windows軟體工程師 ,11/15,"月薪36,000~55,000元",冠信電腦股份有限公司,全職,桃園市龜山區復興一路361號3樓
2279,BIOS韌體工程師 ,11/13,待遇面議,華擎科技股份有限公司,全職,台北市北投區中央南路二段37號2F
2280,微服務平台暨DevOps工程師(組織擴編) ,10/18,"月薪38,000~50,000元",烜宇科技股份有限公司,全職,台北市內湖區民權東路6段16之3號4樓
2281,Computer Vision Software Engineer (電腦視覺/影像處理工程師) ,10/30,"月薪70,000~120,000元",實見有限公司,全職,新北市新店區寶橋路
2282,三商家購-資訊處-資深資料工程師 A01 ,11/15,待遇面議,美廉社_三商家購股份有限公司,全職,台北市中山區民權東路三段4號地下一層
2283,軟韌體測試工程師(內湖) ,11/03,待遇面議,易通展科技股份有限公司,全職,台北市內湖區新湖三路289號2F
2284,研發替代役_工研院中分院_通訊工程師(0H300) ,11/15,待遇面議,工研院 _財團法人工業技術研究院,全職,新竹縣竹東鎮中興路四段195號
2285,自動化研發(資深)工程師(新竹) ,11/17,待遇面議,鴻海精密工業股份有限公司,全職,新竹市
2286,【研究發展處】Java Engineer/Java 軟體工程師 ,11/15,待遇面議,現觀科技股份有限公司,全職,台北市中山區中山北路二段42號2樓
2287,信託處-投資分析人員 ,11/15,待遇面議,永豐商業銀行股份有限公司,全職,台北市中山區台北市中山區南京東路三段36號
2288,數據工程師 【資料分析應用處】 ,11/16,待遇面議,邁達特數位股份有限公司,全職,台北市內湖區台北市內湖區內湖路一段516號10樓
2289,"資料科學工程師 （Data Science R&D）- 分散式演算法應用開發 - 資料科學研發 (數數發中心, DDT) ",11/09,待遇面議,國泰金控_國泰金融控股股份有限公司,全職,台北市信義區松仁路７號
2290,MIT-北科大 城市科學實驗室副研究員-電子電機工程師 ,11/12,待遇面議,國立臺北科技大學,全職,台北市大安區忠孝東路三段46號1樓
2291,程式設計師 ,11/14,"月薪36,000~50,000元",立揚通運股份有限公司,全職,高雄市小港區廠邊一路9號
2292,數據分析師 ,11/13,待遇面議,DIGITIMES INC._大椽股份有限公司,全職,台北市松山區民生東路四段133號12樓
2293,(中部)WEB前端工程師 ,11/12,待遇面議,英屬維京群島商沃亨科技有限公司台灣分公司,全職,台中市北區東光六街20-3號
2294,股權交易員 ,11/16,待遇面議,台新綜合證券股份有限公司,全職,台北市中山區
2295,Linux Driver開發工程師 0608A ,11/01,待遇面議,Phison Electronics Corp_群聯電子股份有限公司,全職,苗栗縣竹南鎮群義路1號
2296,MIS智能系統規劃主管 ,11/16,待遇面議,欣偉科技股份有限公司,全職,桃園市大園區工一路13號(大園擴大工業區)
2297,驗證測試工程師 ,11/16,待遇面議,凌華科技股份有限公司,全職,桃園市龜山區華亞一路66號(歡迎至”Join us! 為何要加入凌華 https://pse.is/UKECY”查看更多福利內容)
2298,韌體工程師 (Firmware Engineer) ,11/07,待遇面議,英屬開曼群島商意騰科技股份有限公司台灣分公司,全職,新竹縣竹北市(高鐵新竹站旁暐順經貿大樓)
2299,資安服務工程師-技術支援(台中總部) ,11/02,"月薪27,400~43,000元",誠雲科技股份有限公司,全職,台中市西屯區臺灣大道四段925號16F-3
2300,資深後端工程師(年薪90-120萬) ,11/13,待遇面議,磊山保險經紀人股份有限公司,全職,台北市中山區
2301,資訊工程師 ,11/15,"月薪35,000~50,000元",知洋科技股份有限公司,全職,新北市新莊區中正路657之2號3樓
2302,軟體工程師 ,11/12,待遇面議,旺捷智能感知股份有限公司,全職,台北市大安區光復南路438號9樓
2303,PHP 後端工程師 / Junior Backend Engineer ,11/17,"月薪40,000元以上",瑞盛數位科技股份有限公司,全職,台北市松山區民生東路三段101號8樓
2304,DevOps Engineer ,11/16,"月薪60,000~90,000元",新加坡商晶格股份有限公司台灣分公司,全職,台北市大安區復興南路一段127號8樓
2305,【產品處】Data engineer ,11/14,"年薪520,000~910,000元",域動行銷股份有限公司,全職,台北市松山區松山區南京東三段285號10樓 (安泰大樓)
2306,Python工程師 ,11/06,待遇面議,博賢智能科技有限公司,全職,澳門特別行政區
2307,軟體工程師 ,11/14,待遇面議,眾匯智能健康股份有限公司,全職,台北市南港區三重路19-13號5樓E棟
2308,WiFi Router-軟韌體研發工程師(RDSW_162) ,11/15,待遇面議,正文科技股份有限公司,全職,新竹縣湖口鄉中華路15-1號
2309,FPGA系統工程師 ,11/16,待遇面議,捷揚航電股份有限公司,全職,台北市南港區園區街3-2號9樓(H棟)
2310,影像處理工程師(AI開發組) ,11/16,"月薪38,000~55,000元",帷享科技股份有限公司台中分公司,全職,台中市南區忠明南路787號23樓
2311,物聯網軟體工程師 ,11/13,"月薪32,000~50,000元",原人股份有限公司,全職,台中市西區台灣大道二段2號11樓之6
2312,"資料工程師 Data Engingeer, VSX ",11/14,待遇面議,ViewSonic Corporation_優派國際股份有限公司,全職,新北市中和區連城路192號9樓(235)
2313,Technical Support Engineer(Japan) ,11/13,待遇面議,廣達集團_雲達科技股份有限公司,全職,日本
2314,〔Student Intern 學生實習專區〕VLSI Physical Design CAD Intern - Summer 2024 ,11/15,待遇面議,NVIDIA_新加坡商輝達開發有限公司台灣分公司,全職,新竹市
2315,機器學習工程師(Machine Learning Engineer) ,11/13,待遇面議,衛利生物科技股份有限公司,全職,新北市新店區北新路3段219號15樓
2316,"【資訊板塊】QA測試工程師(數數發中心, DDT)(高雄) ",11/17,待遇面議,國泰世華商業銀行股份有限公司_人力資源部,全職,高雄市前鎮區
2317,工研院電光系統所_韌體工程師(S500/台南沙崙) ,11/13,待遇面議,工研院 _財團法人工業技術研究院,全職,台南市歸仁區
2318,影像處理工程師 ,11/13,待遇面議,慧穩科技股份有限公司,全職,台中市西屯區市政路500號7樓之6
2319,DA 遊戲數值設計師 ,11/15,待遇面議,神來也麻將_慧邦科技股份有限公司,全職,台北市中正區羅斯福路2段100號10樓
2320,RTOS / Embedded system engineer ,11/16,待遇面議,PHOENIX TECHNOLOGIES INC_美商費尼克斯有限公司台灣分公司,全職,台北市內湖區瑞湖街88號7樓
2321,"Intern, Data Analysis and Administration ",10/25,"月薪27,000~30,000元",英屬百慕達商美國再保險股份有限公司台灣分公司,兼職 - 長期工讀,台北市信義區基隆路一段333號20樓2008室
2322,Junior Algo Developer ,11/17,待遇面議,金原投資有限公司,全職,台北市大安區仁愛路四段151巷
2323,新鮮人徵才計畫-資訊類(可遠端工作) ,11/17,"月薪34,000~40,000元",台灣大哥大股份有限公司,全職,台北市大安區
2324,FPGA FAE/AE ,11/16,待遇面議,安利得科技股份有限公司,全職,新北市汐止區新台五路一段81號15樓之6
2325,資訊人員 ,11/13,"月薪32,000元以上",益張實業股份有限公司,全職,彰化縣埤頭鄉興工路4號
2326,演算法開發工程師 ,10/02,待遇面議,啟樺機械工業股份有限公司,全職,新北市樹林區佳園路二段15巷9弄2號(238)
