,職稱,更新日期,薪資待遇,公司名稱,工作性質,公司地址
1331,DevOps Developer ,11/16,"年薪1,500,000~3,000,000元",美商海鸚科技股份有限公司台灣分公司,全職,台北市中正區襄陽路9號21樓
1332,軟體設計工程師(四組) ,11/13,待遇面議,康和綜合證券股份有限公司,全職,高雄市新興區中正三路55號17樓
1333,"東南亞金融科技發展-商業分析師（數數發中心, DDT） ",11/09,待遇面議,國泰金控_國泰金融控股股份有限公司,全職,台北市信義區松仁路7號
1334,初級軟體工程師(台北) ,11/16,待遇面議,"SiliconCore Taiwan CO.,Ltd._矽芯股份有限公司",全職,台北市大安區敦化南路二段97號2樓
1335,軟體支援助理工程師 ,11/08,待遇面議,神聚系統整合有限公司,全職,新竹縣竹北市光明六路87之5號11樓之1室
1336,AI工程師 ,11/17,"月薪50,000元以上",沙漠魚科技股份有限公司,全職,台北市大安區敦化南路二段99號3樓
1337,FAE Manager / senior Manager ,11/17,待遇面議,英屬維京群島商視芯智能股份有限公司台灣分公司,全職,新竹縣竹北市嘉豐十一路一段100號11樓之3
1338,幼兒園陪玩老師/遊戲程式設計老師 (基隆市仁愛區) ,11/09,時薪200~600元,臺北市私立何氏語文短期補習班,兼職 - 長期工讀、短期工讀,基隆市仁愛區
1339,C++ software developer ,10/03,"年薪500,000~1,300,000元",艾知科技股份有限公司,全職,台北市內湖區新湖三路288號ＥＦ
1340,機器視覺應用工程師(北部) ,11/13,待遇面議,弘翔精密科技股份有限公司,全職,新北市板橋區雙十路2段52號9樓
1341,JNR330-AI Engineer ,11/15,待遇面議,啟碁科技股份有限公司,全職,新竹市園區二路20號(新竹科學工業園區)
1342,機率工程師 ,11/16,待遇面議,塶樂微創有限公司,全職,台中市西屯區
1343,通訊系統模擬工程師 ,11/16,待遇面議,聯發科技股份有限公司,全職,新竹市篤行一路1號
1344,數據分析工程師 (Data Analytics Engineer) ,11/14,待遇面議,博晶醫電股份有限公司,全職,新北市新店區北新路三段205號7F(捷運綠線-大坪林站)
1345,數位平台營運工程師(DTO) ,10/20,待遇面議,貿聯國際股份有限公司,全職,新北市中和區建一路186號3樓
1346,數據分析師(碩士) ,11/16,"月薪44,000~69,000元",弈樂科技股份有限公司,全職,台中市西屯區安和東路3號6樓
1347,資料工程師 ,11/17,"月薪35,000~60,000元",信福開發國際有限公司,全職,台中市西屯區市政北二路236號29樓之1
1348,流程自動化設計實習生 (提供留任正職機會) ,11/15,時薪190~205元,AsiaYo_亞洲遊科技股份有限公司,兼職 - 長期工讀,台北市大安區敦化南路2段77號18樓之3
1349,【高雄】MIS 資訊工程師 ,11/15,"月薪54,000元以上",長春人造樹脂廠股份有限公司,全職,高雄市大社區興工路1-3號
1350,網頁程式工程師 ,11/16,"月薪45,000~55,000元",國立臺灣師範大學_資訊工程學系,全職,台北市文山區汀州路四段88號
1351,Web Application Engineer ,10/30,待遇面議,雲創通訊股份有限公司,全職,新竹縣竹北市高鐵二路32號17樓之3
1352,AI Engineers/Managers(Taipei/Hsinchu) ,07/24,待遇面議,愛瑪麗歐股份有限公司,全職,台北市大安區敦化南路二段182號12樓 or 新竹縣竹北市縣政九路159號4樓
1353,【2024研發替代役暨預聘】AI應用工程師_台灣智能製造(桃一) ,11/14,待遇面議,台達電子工業股份有限公司 _DELTA ELECTRONICS INC.,全職,桃園市龜山區興邦路31-1號
1354,幼兒園陪玩老師/遊戲程式設計老師 (三重) ,11/09,時薪200~600元,臺北市私立何氏語文短期補習班,兼職 - 長期工讀、短期工讀,新北市三重區
1355,軟體測試工程師 ,11/14,"月薪40,000~100,000元",初陽科技有限公司,全職,台北市中山區樂群二路187號6樓之3
1356,視覺事業處-人工智能後端工程師(AI Backend Engineer)_(VBU) ,11/15,待遇面議,所羅門股份有限公司,全職,台北市內湖區行忠路42號
1357,25 資訊軟體工程師 ,11/15,待遇面議,新代科技股份有限公司,全職,新竹市新竹市科學工業園區研發二路25號
1358,程式設計師 ,11/16,待遇面議,裕民航運股份有限公司,全職,台北市大安區敦化南路二段207號29樓
1359,後端網頁工程師 ,11/13,"月薪30,000~70,000元",展市華科技有限公司,全職,桃園市龜山區或南港區
1360,決策分析與最佳化演算法開發工程師 (台南) ,11/16,待遇面議,群創光電股份有限公司,全職,台南市新市區台南市新市區環西路一段3號/苗栗縣竹南鎮科學路168號
1361,【技術部】助理數據分析師 ,11/13,"月薪34,000~45,000元",聯合線上股份有限公司,全職,新北市汐止區大同路一段369號
1362,"雲端數據工程師 - 數據科技 (數數發中心, DDT) ",11/09,待遇面議,國泰金控_國泰金融控股股份有限公司,全職,台北市信義區松仁路7號
1363,【數據發展部】數據分析師-分析 ,11/08,待遇面議,聯合報股份有限公司,全職,新北市汐止區大同路一段369號
1364,"Staff Software Development Engineer in Test, Netskope Private Access ",11/13,"年薪1,900,000元以上","Kloudless, A Netskope Company_科迪股份有限公司",全職,台北市信義區信義路四段460號14樓
1365,自動化與軟體研發工程師 (助理工程師/工程師/系統分析師/專案經理人) ,11/13,"月薪32,000~55,000元",明億鑫精密股份有限公司,全職,台中市神岡區東洲路269號
1366,產經實習助理、投資助理 ,11/08,時薪180元以上,泉碩科技股份有限公司,兼職 - 長期工讀,台北市大同區迪化街一段63號10樓(一銀樓上)
1367,【影像技術部】演算法工程師 ((中壢)) ,11/17,待遇面議,昇銳電子股份有限公司,全職,桃園市中壢區中正路105號4號
1368,資訊處 軟體開發工程師 ,10/25,待遇面議,中嘉數位股份有限公司,全職,台北市內湖區瑞光路399號3樓
1369,機器視覺工程師 ,11/16,"月薪40,000~60,000元",三向科技有限公司,全職,新北市新莊區化成路814巷17號
1370,NSR14 驗證工程師/資深工程師 ,11/15,"月薪35,000~50,000元",新普科技股份有限公司,全職,新竹縣湖口鄉八德路二段471號(303)
1371,AI 影像演算法工程師 ,11/16,"月薪45,000~52,000元",晶新資訊股份有限公司,全職,高雄市苓雅區新光路38號24樓之6
1372,資料工程師(T53) ,11/15,待遇面議,關貿網路股份有限公司,全職,台北市南港區三重路19之13號6樓(115)
1373,[大數據股市掘金系統] 專案工程師/助理工程師 ,11/10,"月薪30,000~80,000元",全富數位有限公司,全職,台中市北區崇德路一段631號17樓之3
1374,軟體開發工程師_12576 ,11/13,"月薪30,000~51,000元",和碩集團_和碩聯合科技股份有限公司,全職,台北市北投區立功街76號
1375,【威剛2024實習生計劃】實習類-驗證軟體開發工程師 ,11/14,時薪200元,威剛科技股份有限公司,全職,新北市中和區連城路258號18樓
1376,助理工程師 ,11/14,"月薪28,000~35,000元",大砌國際電子股份有限公司,全職,新竹市東美路91巷5號7樓
1377,愛買_總公司 行銷部 CRM 經/副理 ,11/13,待遇面議,遠百企業股份有限公司_愛買,全職,新北市板橋區貴興路101號4樓(近捷運亞東醫院站，步行約8分鐘)
1378,系統工程師 ,09/04,"月薪38,000~50,000元",慧手科技股份有限公司,全職,新北市新莊區中正路649-9號8樓
1379,Quality Assurance Engineer 測試工程師 ,11/08,待遇面議,智齡科技股份有限公司,全職,新北市新店區北新路三段213號6樓
1380,抗老科學研究中心 助理研究員 ,11/11,待遇面議,醫新生命科學股份有限公司,全職,台北市大安區敦化南路二段65號6樓
1381,【數轉院/網路維運技術中心】AI工程師 ,11/10,待遇面議,資策會_財團法人資訊工業策進會,全職,台北市松山區民生東路4段133號8號
1382,Pipeline Technical Director 技術工程師 ,06/09,待遇面議,再現影像製作股份有限公司,全職,台北市內湖區
1383,【GenApe】AI工程師、機器學習工程師、資料科學家（AI Engineer） ,11/14,"月薪42,000~75,000元",玩構網路科技有限公司,全職,高雄市楠梓區
1384,後端工程師 ,11/13,待遇面議,細細生活網路科技股份有限公司,全職,台北市中山區通北街31巷22弄2號
1385,Back-end Engineer 後端工程師 (Billing)(C#) | CBU_10_09 ,11/16,待遇面議,伊雲谷數位科技股份有限公司,全職,新北市三重區三和路四段111之32號7樓
1386,UI美工設計 ,11/13,"月薪27,000~50,000元",艾瑞蒙科技有限公司,全職,台南市安平區育平九街229號
1387,Mixed-Signal Design Engineer-新店 ,11/15,待遇面議,慧榮科技股份有限公司_SMI,全職,新北市新店區北新路一段86號26樓
1388,測試驗證工程師 ,11/16,待遇面議,先進車系統股份有限公司,全職,新竹縣竹北市高鐵二路32號
1389,Mixed-Signal Design Engineer-新店 ,11/15,待遇面議,慧榮科技股份有限公司_SMI,全職,新北市新店區北新路一段86號26樓
1390,SSD 驗證工程師 ,11/15,待遇面議,台灣特納飛科技有限公司,全職,新竹縣竹北市台元街38號6樓之12
1391,微風精品線上_電商行銷數據分析/廣告投放專員 ,11/16,"月薪35,000元以上",微風廣場實業股份有限公司,全職,台北市松山區復興南路一段39號
1392,工研院機械所-機器視覺軟體工程師(Q500) ,11/13,待遇面議,工研院 _財團法人工業技術研究院,全職,新竹縣竹東鎮中興路四段195號
1393,lOT軟韌體研發工程師 ,11/15,待遇面議,金緻網路資訊服務股份有限公司,全職,台北市大安區和平東路2段201號11樓之1
1394,Golang服務端工程師 ,11/16,"月薪70,000~150,000元",禾向數位科技有限公司,全職,台北市松山區
1395,數位轉型發展中心【系統導入顧問/工程師】 ,11/15,待遇面議,零壹科技股份有限公司_Zero One Tech,全職,台北市內湖區內湖路一段360巷8號10樓
1396,經管專員(工作地點台北高雄皆可) ,11/14,待遇面議,瑞師科技股份有限公司,全職,高雄市路竹區 大同路513巷96號
1397,影像處理與人工智慧應用工程師(台北、新竹) ,11/09,待遇面議,鉅怡智慧股份有限公司,全職,新竹市東區博愛街75號賢齊館10樓
1398,物聯網後端工程師 ,11/09,待遇面議,大儀股份有限公司,全職,台北市中山區民權東路3段6號17F
1399,軟體工程師 ,11/16,待遇面議,常珵科技股份有限公司,全職,新北市樹林區博愛街236號1樓
1400,AI工程師 ,11/13,待遇面議,雄獅資訊科技股份有限公司,全職,台北市內湖區石潭路151號
1401,【2024神基科技一年期實習專案】軟體研發實習工程師_RSBU ,11/15,"月薪33,000~37,000元",神基科技股份有限公司,兼職 - 長期工讀,台北市南港區南港路一段209號A棟5樓
1402,Solution Engineer/ Application Engineer ,11/14,待遇面議,創鑫智慧股份有限公司,全職,新竹市新竹科學園區創新三路6號6樓
1403,61584_Quality Data Engineer (Taichung) ,11/16,待遇面議,台灣康寧顯示玻璃股份有限公司,全職,台中市西屯區中部科學園區科園路1號
1404,數位IC工程師-DFT工程師 ,11/06,待遇面議,芯測科技股份有限公司,全職,新竹縣竹北市台元一街6號7樓之5
1405,機器人機電整合工程師 ,11/15,"月薪40,000~65,000元",泰科動力股份有限公司,全職,新北市林口區大水湳路39號
1406,交易員(新金融商品部) ,11/13,待遇面議,康和綜合證券股份有限公司,全職,台北市信義區基隆路一段176號14樓
1407,MIS專員 ,11/14,待遇面議,前導國際股份有限公司,全職,新北市三重區重新路五段609巷20號10樓之4
1408,資訊工程師 ,11/16,"月薪37,000~60,000元",YAMAHA(YMRT)_台灣山葉發動機研究開發中心股份有限公司,全職,新竹縣湖口鄉東興村山葉路81號
1409,資訊工程師 ,11/16,"月薪37,000~60,000元",YAMAHA(YMRT)_台灣山葉發動機研究開發中心股份有限公司,全職,新竹縣湖口鄉東興村山葉路81號
1410,專案經理（台北101) ,11/17,待遇面議,双融域股份有限公司,全職,台北市信義區信義路五段7號
1411,網站全端工程師 Full-Stack Engineer ,11/14,"月薪40,000元以上",寰澔生物科技有限公司,全職,台北市大同區民權西路237之1號18樓之3(超站S大樓)
1412,計量投資人員 ,10/30,待遇面議,第一金證券投資信託股份有限公司,全職,台北市中山區民權東路三段6號7樓
1413,ERP系統導入工程師/軟體設計工程師 ,11/06,待遇面議,科普貿易股份有限公司,全職,台南市東區
1414,Java 研發工程師(財務系統) ,11/15,"年薪1,000,000~2,000,000元",可因科技有限公司,全職,台北市中山區
1415,AI Scientist （ LLM ） ,11/15,待遇面議,歐易亞科技股份有限公司,全職,台北市中正區羅斯福路二段100號25樓(古亭捷運9號出口正門)
1416,【擴編】資深系統工程師 ,11/17,"月薪60,000元以上",騰雲運算股份有限公司,全職,新北市新莊區新北大道四段185號5樓
1417,FAE Engineer ,11/15,待遇面議,TechNexion Ltd_彤晟科技股份有限公司,全職,新北市中和區平河里中正路736號16樓之5
1418,REQ_23104919 AW0361 ERP系統開發工程師 ,11/13,待遇面議,啟碁科技股份有限公司,全職,新竹縣寶山鄉園區二路20號
1419,資深MCU韌體工程師【PM1】 ,11/15,待遇面議,宸曜科技股份有限公司,全職,新北市中和區中正路868-3號15F
1420,自動化測試軟體工程師_12631 ,11/15,"月薪32,000~62,000元",和碩集團_和碩聯合科技股份有限公司,全職,台北市北投區立功街76號
1421,徵 數據處-校務研究中心-專任職員1名 ,10/11,"月薪40,000~42,000元",臺北醫學大學,全職,新北市中和區圓通路301號
1422,韌體程式設計師 ,11/16,待遇面議,奕垣科技有限公司,全職,新北市林口區南勢二街358號1樓
1423,SW工程師/技術經理 ,10/27,待遇面議,博磊智能有限公司,全職,新竹縣竹北市復興三路二段168號19樓之1
1424,結構CAE工程師 ,11/17,"年薪700,000~1,000,000元",士盟科技股份有限公司,全職,台北市中山區南京東路二段90號14樓
1425,After-serivce Data Analyst 售後服務規劃數據分析師 ,11/15,待遇面議,Gogoro Taiwan Limited_睿能創意股份有限公司,全職,台北市松山區長安東路二段225號
1426,PE -Product Engineer(Calibre_ Integrated Circuit Design) ,11/15,待遇面議,Siemens EDA_愛爾蘭商西門子電子設計自動化股份有限公司台灣分公司,全職,新竹市
1427,自營部交易員(系統開發) ,11/14,"月薪40,000~70,000元",凱基期貨股份有限公司,全職,台北市中山區明水路700號6樓(凱基金融大樓)
1428,(台中上班!) AI應用服務高階技術主管-Senior Technical Supervisor of AI Application Services ,11/13,待遇面議,怡利電子工業股份有限公司,全職,台中市西屯區市政北七路186號
1429,數據工程師 ,11/16,"月薪30,000~40,000元",神預科技有限公司,全職,台南市北區開元路147號5樓
1430,應用工程師(新竹市) ,11/13,待遇面議,捷創科技股份有限公司,全職,新竹市關新路27號6樓之1
1431,前端工程師 ,11/12,"月薪50,000~70,000元",安瑟樂威股份有限公司,全職,台北市信義區松德路171號10樓-1
1432,系統工程師 ,11/16,"月薪33,866元以上",國立臺灣師範大學_科技應用與人力資源發展學系,全職,台北市大安區和平東路一段129號
1433,多媒體執行製作 ,11/15,"月薪36,000~46,000元",天工開物股份有限公司,全職,台北市大安區仁愛路三段17號2樓
1434,數據分析師-行銷 ,10/26,待遇面議,聯經數位股份有限公司,全職,新北市汐止區大同路一段369號
1435,Bioinformatician 生物資訊工程師 ,11/16,待遇面議,瑞林生物科技股份有限公司,全職,台北市大安區光復南路630號5樓
1436,【2023應屆畢業生/社會新鮮人限定】研發工程師_潛力青年計畫招聘專區 ,11/10,待遇面議,肚肚股份有限公司,全職,高雄市前鎮區成功二路25號12樓
1437,售後服務工程師 ,11/16,待遇面議,鋐寶科技股份有限公司,全職,新竹縣竹北市台元一街1號13樓
1438,測試外包管理工程師 ,11/15,待遇面議,鴻海集團_鴻揚半導體股份有限公司,全職,新竹市東區研新三路3號
1439,"Software Engineer, Intern / Part-time ",11/06,"月薪35,000~60,000元",臺灣發展軟體科技股份有限公司,全職,台北市內湖區瑞光路
1440,韌體研發工程師 ,11/16,待遇面議,捷揚航電股份有限公司,全職,台北市南港區園區街3-2號9樓(H棟)
1441,AI演算法工程師｜AI Algorithm Engineer ,11/16,待遇面議,薩摩亞商動見科技股份有限公司台灣分公司,全職,台北市大安區仁愛路四段107號(環球企業大樓14樓)
1442,DevOps工程師 ,11/14,"月薪45,000~60,000元",薩摩亞商毅成科技有限公司,全職,台北市松山區南京東路三段248號5F之1
1443,【台北公司】AI軟體工程師 ,11/15,"月薪54,000元以上",長春人造樹脂廠股份有限公司,全職,台北市中山區松江路301號7樓(104)
1444,Ubuntu Desktop and Embedded Linux Software Engineer ,10/20,"年薪1,200,000元以上",Canonical_英商科能有限公司台灣分公司,全職,台北市松山區民生東路三段100號12樓
1445,AI影像處理工程師 ,11/15,待遇面議,虹承科技有限公司,全職,高雄市鼓山區大順一路439號8樓之二
1446,Junior/Senior Backend Engineer (vocol.ai) ,11/13,待遇面議,犀動智能科技股份有限公司,全職,台北市內湖區陽光街321巷60號5樓
1447,MIS高級專員-程式設計 ,11/14,待遇面議,鈺邦科技股份有限公司,全職,苗栗縣竹南鎮科東三路2、6號4樓
1448,物聯網工程師 ,11/16,"月薪32,000~40,000元",基士德環科股份有限公司,全職,高雄市鼓山區民利街19號
1449,FP&A Consultant 財務分析專案諮詢顧問 ,11/14,待遇面議,香港商凱渤維思有限公司台灣分公司,全職,台北市中正區北平東路30-1號4樓
1450,軟體工程師 ,11/15,"月薪35,000~50,000元",中揚光電股份有限公司,全職,台中市南屯區工業區二十二路21號
1451,SG_AI Consultant ,11/17,待遇面議,博弘雲端科技股份有限公司,全職,新加坡Singapore (Stationed or on a business trip)
1452,PA1452 軟體開發工程師/高級工程師(內湖) ,08/07,待遇面議,仁寶電腦工業股份有限公司,全職,台北市內湖區瑞光路581號(114)
1453,【日本東京】工程師培訓就職2024春季班（已在日求職/轉職可應徵） ,11/15,待遇面議,株式会社シエス情報,全職,日本110-0015 東京都台東区東上野
1454,Data Engineer 亞太IT服務業界指標 ,11/15,"月薪80,000元以上",艾福提資訊有限公司,全職,台北市信義區
1455,T.稅務類-專員/資深專員(國內稅務簽證服務) ,11/15,"月薪38,000~48,000元",資誠聯合會計師事務所,全職,台北市信義區基隆路一段333號
1456,新鮮人-軟體-自動化工程師 - J1339 ,11/15,待遇面議,廣達電腦股份有限公司,全職,桃園市龜山區文化二路211號
1457,【金融交易】財務工程人員 ,11/16,待遇面議,台新綜合證券股份有限公司,全職,台北市中山區
1458,元件工程師 ,11/17,待遇面議,創未來科技股份有限公司,全職,新竹市東區公道五路三段1號7樓之8
1459,Django網頁工程師 ,11/15,"月薪35,000元以上",兆徠科技股份有限公司,全職,台北市內湖區行愛路77巷69號2樓
1460,集團MIS維運主管 (TOC) ,11/17,待遇面議,城邦媒體控股集團_城邦文化事業股份有限公司,全職,台北市中山區民生東路二段141號11樓
1461,自動化視覺軟體工程師 ,11/17,待遇面議,達亞國際股份有限公司,全職,桃園市蘆竹區南山路一段200號
1462,全職程式授課老師 ,11/14,"月薪50,000元以上",瑞智教育科技股份有限公司,全職,台北市大安區忠孝東路三段96號3樓
1463,程式設計助理 ,11/08,時薪176元,大同醫護股份有限公司,兼職 - 長期工讀,台北市中山區中山北路三段22號 北社工6樓
1464,助理工程師 ,11/14,"月薪30,000~38,000元",芯華電腦有限公司,全職,台北市中正區忠孝東路一段9號9樓
1465,AMR系統韌體開發工程師 ,11/10,待遇面議,佳研智聯股份有限公司,全職,台中市南屯區精科路2號
1466,遊戲開發工程師 ,11/14,"月薪35,000~40,000元",艾伯特電通股份有限公司,全職,台北市中正區和平西路二段141號4樓之8
1467,自動控制工程師 ,11/09,"月薪35,000~52,000元",佑昇精密有限公司,全職,台南市歸仁區中正北路二段75巷38弄287號
1468,北大泰坦星球-(兼職)科技老師 ,11/13,時薪500~700元,英博創意教育事業有限公司,兼職,新北市樹林區學成路 669號
1469,北大泰坦星球-(兼職)科技老師 ,11/13,時薪500~700元,英博創意教育事業有限公司,兼職,新北市樹林區學成路 669號
1470,Python課程講師-永和認證中心 ,11/15,"時薪300~1,200元",聯成電腦有限公司(聯成電腦/聯成外語),兼職,新北市永和區永和路2段59號4樓
1471,全端工程師 Full Stack Developer ,11/17,待遇面議,財團法人MIH EV 研發院,全職,台北市南港區經貿二路1號
1472,軟體測試工程師(SQA) ,11/15,待遇面議,凱銳光電股份有限公司,全職,台北市內湖區陽光街300號3樓
1473,資安工程師(數位鑑識)-20006224 ,11/13,"月薪35,000元以上",安碁資訊股份有限公司,全職,台北市信義區
1474,軟體專案經理-水利 ,10/11,"月薪48,000~70,000元",興創知能股份有限公司,全職,台北市松山區南京東路四段16號5樓A1室
1475,Android App研發工程師 ,11/08,"月薪50,000元以上",戴克智慧股份有限公司,全職,桃園市龜山區
1476,【凱基證券/衍生性商品部】量化分析人員 ,05/15,待遇面議,中華開發金融控股股份有限公司(凱基證券)(凱基銀行)(中華開發資本),全職,台北市中山區明水路700號
1477,BI Head ,10/19,待遇面議,CATCHPLAY_英屬蓋曼群島商威望國際娛樂股份有限公司台灣分公司,全職,台北市內湖區瑞光路480號10樓
1478,NFT 全端工程師 ,11/15,待遇面議,易元數位科技有限公司,全職,新竹市東區關東路158號2樓之1
1479,韌體工程師 ,11/17,待遇面議,凱亞科技股份有限公司,全職,台北市南港區向陽路189號1樓
1480,產業及市場調研人員 ,11/15,"月薪35,000~45,000元",振芳股份有限公司,全職,台北市中正區新生南路一段116號
1481,60106S0_商業智慧系統及數據工程師 ,11/16,待遇面議,神通資訊科技股份有限公司,全職,台北市內湖區堤頂大道二段187號
1482,集團總部 | 數據部 | Data Scientist (數據科學家)[組織擴張] ,11/12,待遇面議,歐悅金融科技股份有限公司,全職,新北市新莊區新莊區新北大道3段7號14樓之3
1483,後端工程師 ,11/13,待遇面議,台灣新光保全股份有限公司(SKS),全職,台北市內湖區新湖二路128號3樓
1484,【RD】深度感知影像資深工程師 - CTC2003 ,11/14,待遇面議,鴻海集團_新煒科技有限公司,全職,新北市土城區承天路31號
1485,數據管理分析師Data Management Analyst ,11/15,待遇面議,統一資訊股份有限公司,全職,台北市內湖區陽光街246號6樓
1486,雲端數據軟體工程師 ,09/26,待遇面議,尚茂智能科技股份有限公司,全職,台北市內湖區洲子街68號6樓
1487,電腦系統工程師 ,11/13,待遇面議,台塑_臺灣塑膠工業股份有限公司,全職,台北市內湖區
1488,軟體開發工程師(總所) ,11/16,"月薪45,000~60,000元",嘉威聯合會計師事務所,全職,新北市五股區五工五路28號4樓
1489,Senior CAD Engineer - Hsinchu/Taipei ,11/15,待遇面議,NVIDIA_新加坡商輝達開發有限公司台灣分公司,全職,新竹市或台北內湖區
1490,MIT-北科大 城市科學實驗室副研究員 ,11/12,待遇面議,國立臺北科技大學,全職,台北市大安區忠孝東路三段46號1樓
1491,電控韌體工程師 ,11/15,待遇面議,車王電子股份有限公司,全職,台中市大雅區中清路4段85號
1492,Junior Backend Engineer (Business Architect) 軟體工程師 ,08/30,待遇面議,恩沛科技股份有限公司,全職,台北市中山區復興北路378號5樓
1493,軟體工程師 ,11/15,待遇面議,台鎔科技材料股份有限公司,全職,桃園市觀音區環科路216號
1494,.Net工程師（1年以上）-AP2 ,11/02,待遇面議,探網科技股份有限公司,全職,台北市中正區杭州南路一段23號11樓之3
1495,[實習] 資料處理工程師 ,11/15,時薪180~200元,英霸聲學科技股份有限公司,兼職 - 長期工讀、短期工讀、假日工讀、寒假工讀、暑假工讀,新北市中和區中正路738號13樓之9
1496,AI Scientist ( LLM ) ,11/15,待遇面議,歐易亞科技股份有限公司,兼職,台北市中正區羅斯福路二段100號25樓(古亭捷運9號出口正門)
1497,I_ 軟體工程師(新竹) ,11/16,待遇面議,奇景光電股份有限公司,全職,新竹市光復路二段289號5樓
1498,設計驗證工程師 ,11/17,待遇面議,耀泉科技有限公司,全職,新竹縣竹北市環科一路21號8F-1(昌益科技園區)
1499,MIS資訊工程師 ,11/16,"月薪32,000~40,000元",洽富實業股份有限公司,全職,台中市梧棲區自立一街183號
1500,網站可靠性工程師 (SRE) ,11/17,待遇面議,關網資訊股份有限公司,全職,台北市大安區忠孝東路四段285號2樓之2
